{
  "$schema": "http://json-schema.org/draft-07/schema#",
  "title": "uptime_result",
  "$ref": "#/definitions/CheckResult",
  "definitions": {
    "CheckStatus": {
      "title": "check_status",
      "description": "The status of the check",
      "type": "string",
      "enum": ["success", "failure", "missed_window", "disallowed_by_robots"]
    },
    "CheckStatusReasonType": {
      "title": "check_status_reason_type",
      "description": "The type of the status reason",
      "type": "string",
      "enum": [
        "timeout",
        "dns_error",
        "failure",
        "tls_error",
        "connection_error",
        "redirect_error",
        "miss_produced",
        "miss_backfill",
        "assertion_compilation_error",
        "assertion_evaluation_error"
      ]
    },
    "RequestType": {
      "title": "request_type",
      "description": "The type of HTTP method used for the check",
      "type": "string",
      "enum": ["GET", "POST", "HEAD", "PUT", "DELETE", "PATCH", "OPTIONS"]
    },
    "CheckStatusReason": {
      "title": "check_status_reason",
      "description": "Reason for the status, primarily used for failure",
      "type": "object",
      "properties": {
        "type": {
          "$ref": "#/definitions/CheckStatusReasonType"
        },
        "description": {
          "description": "A human readable description of the status reason",
          "type": "string"
        }
      },
      "required": ["type", "description"]
    },
    "Timing": {
      "title": "timing",
      "type": "object",
      "properties": {
        "start_us": {
          "description": "Start of the timing, timestamp in microseconds.",
          "type": "number"
        },
        "duration_us": {
          "description": "Duration of the timing, in microseconds",
          "type": "number"
        }
      },
      "required": ["start_us", "duration_us"]
    },
    "RequestDurations": {
      "title": "request_durations",
      "description": "Durations of each operation in the request",
      "type": "object",
      "properties": {
        "dns_lookup": {
          "$ref": "#/definitions/Timing",
          "description": "Total time from request initiation until DNS resolution completes."
        },
        "tcp_connection": {
          "$ref": "#/definitions/Timing",
          "description": "Time to establish a TCP connection (excluding TLS)."
        },
        "tls_handshake": {
          "$ref": "#/definitions/Timing",
          "description": "Time spent on the TLS handshake."
        },
        "time_to_first_byte": {
          "$ref": "#/definitions/Timing",
          "description": "Time from request start to receiving the first response header byte."
        },
        "send_request": {
          "$ref": "#/definitions/Timing",
          "description": "Time spent sending the request (per OTEL conventions)."
        },
        "receive_response": {
          "$ref": "#/definitions/Timing",
          "description": "Time spent receiving the response (per OTEL)."
        }
      }
    },
    "ResponseHeader": {
      "title": "response_header",
      "description": "A response header, consisting of a name and value as a tuple.",
      "type": "array",
      "prefixItems": [
        {
          "title": "header_name",
          "type": "string"
        },
        {
          "title": "header_value",
          "type": "string"
        }
      ]
    },
    "RequestInfo": {
      "title": "request_info",
      "description": "Additional information about each request made",
      "type": "object",
      "properties": {
        "request_type": {
          "$ref": "#/definitions/RequestType"
        },
        "http_status_code": {
          "description": "Status code of the request",
          "type": ["number", "null"]
        },
        "url": {
          "description": "The full URL being requested",
          "type": ["string"]
        },
        "request_body_size_bytes": {
          "description": "Size of the request body in bytes (per OTEL).",
          "type": ["number"]
        },
        "response_body_size_bytes": {
          "description": "Size of the response body in bytes (per OTEL).",
          "type": ["number"]
        },
        "request_duration_us": {
          "description": "Total measured duration for this specific request in microseconds. This is the actual wall clock time and may differ from summing individual timing components.",
          "type": ["number"]
        },
        "durations": {
          "$ref": "#/definitions/RequestDurations"
        },
        "response_body": {
          "description": "Response body content, captured on failure when configured. Base64 encoded.",
          "type": ["string", "null"]
        },
        "response_headers": {
          "description": "Response headers, captured on failure when configured.",
          "type": ["array", "null"],
          "items": {
            "$ref": "#/definitions/ResponseHeader"
          }
        }
      },
      "required": ["request_type", "http_status_code"]
    },
    "EvalPathKind": {
      "title": "eval_path_kind",
      "description": "The type of path node",
      "type": "string",
      "enum": ["leaf", "all_children", "child_index"]
    },
    "EvalPath": {
      "title": "eval_path",
      "description": "The path of evaluations that lead to a assertion result",
      "type": "object",
      "properties": {
        "kind": {
          "$ref": "#/definitions/EvalPathKind"
        },
        "index": {
          "type": ["integer", "null"]
        },
        "child": {
          "oneOf": [
            {
              "type": "null"
            },
            {
              "$ref": "#/definitions/EvalPath"
            }
          ]
        }
      },
      "required": ["kind"]
    },
    "AssertionOpComparison": {
      "title": "assertion_op_comparison",
      "description": "The kind of comparison to make.",
      "enum": [
        "always",
        "never",
        "less_than",
        "greater_than",
        "equals",
        "not_equals"
      ]
    },
    "AssertionOpHeaderOperandNone": {
      "title": "assertion_op_header_operand_none",
      "description": "A none operand for the comparison",
      "type": "object",
      "properties": {
        "header_op": {
          "type": "string",
          "const": "none"
        }
      }
    },
    "AssertionOpHeaderOperandLiteral": {
      "title": "assertion_op_header_operand_literal",
      "description": "A literal value for comparison",
      "type": "object",
      "properties": {
        "header_op": {
          "type": "string",
          "const": "literal"
        },
        "value": {
          "type": "string"
        }
      }
    },
    "AssertionOpHeaderOperandGlobPattern": {
      "title": "assertion_op_header_operand_glob_pattern",
      "description": "The actual glob pattern, as a string",
      "type": "object",
      "properties": {
        "value": {
          "type": "string"
        }
      }
    },
    "AssertionOpHeaderOperandGlob": {
      "title": "assertion_op_header_operand_glob",
      "description": "A glob pattern for matching",
      "type": "object",
      "properties": {
        "header_op": {
          "type": "string",
          "const": "glob"
        },
        "pattern": {
          "type": "object",
          "$ref": "#/definitions/AssertionOpHeaderOperandGlobPattern"
        }
      }
    },
    "AssertionOpHeaderOperand": {
      "title": "assertion_op_header_operand",
      "description": "A operand for comparison against HTTP header keys and values",
      "anyOf": [
        {
          "$ref": "#/definitions/AssertionOpHeaderOperandGlob"
        },
        {
          "$ref": "#/definitions/AssertionOpHeaderOperandLiteral"
        },
        {
          "$ref": "#/definitions/AssertionOpHeaderOperandNone"
        }
      ]
    },
    "AssertionOpHeaderCheck": {
      "title": "assertion_op_header_check",
      "description": "The HTTP header (key and value) comparison operation",
      "type": "object",
      "properties": {
        "key_op": {
          "$ref": "#/definitions/AssertionOpComparison"
        },
        "key_operand": {
          "$ref": "#/definitions/AssertionOpHeaderOperand"
        },
        "value_op": {
          "$ref": "#/definitions/AssertionOpComparison"
        },
        "value_operand": {
          "$ref": "#/definitions/AssertionOpHeaderOperand"
        }
      }
    },
    "AssertionOpStatusCodeCheck": {
      "title": "assertion_op_status_code_check",
      "description": "The HTTP status code comparison operation",
      "type": "object",
      "properties": {
        "value": {
          "type": "integer"
        },
        "operator": {
          "$ref": "#/definitions/AssertionOpComparison"
        }
      }
    },
    "AssertionOpJsonPath": {
      "title": "assertion_op_jsonpath",
      "description": "The JSONPath query operation",
      "type": "object",
      "properties": {
        "op": {
          "const": "json_path"
        },
        "value": {
          "type": "string"
        }
      }
    },
    "AssertionOpNot": {
      "title": "assertion_op_not",
      "description": "The negation operation",
      "type": "object",
      "properties": {
        "op": {
          "type": "string",
          "const": "not"
        },
        "operand": {
          "$ref": "#/definitions/AssertionOp"
        }
      }
    },
    "AssertionOpOr": {
      "title": "assertion_op_or",
      "description": "The boolean OR operation",
      "type": "object",
      "properties": {
        "op": {
          "type": "string",
          "const": "or"
        },
        "children": {
          "type": "array",
          "items": {
            "$ref": "#/definitions/AssertionOp"
          }
        }
      }
    },
    "AssertionOpAnd": {
      "title": "assertion_op_and",
      "description": "The boolean AND operation",
      "type": "object",
      "properties": {
        "op": {
          "type": "string",
          "const": "and"
        },
        "children": {
          "type": "array",
          "items": {
            "$ref": "#/definitions/AssertionOp"
          }
        }
      }
    },
    "AssertionOp": {
      "title": "assertion_op",
      "description": "All possible assertion operations",
      "anyOf": [
        {
          "$ref": "#/definitions/AssertionOpAnd"
        },
        {
          "$ref": "#/definitions/AssertionOpOr"
        },
        {
          "$ref": "#/definitions/AssertionOpNot"
        },
        {
          "$ref": "#/definitions/AssertionOpStatusCodeCheck"
        },
        {
          "$ref": "#/definitions/AssertionOpJsonPath"
        },
        {
          "$ref": "#/definitions/AssertionOpHeaderCheck"
        }
      ]
    },
    "Assertion": {
      "title": "assertion",
      "description": "The root of the uptime assertion",
      "type": "object",
      "properties": {
        "root": {
          "$ref": "#/definitions/AssertionOp"
        }
      }
    },
    "CheckResult": {
      "title": "check_result",
      "description": "A message containing the result of the uptime check.",
      "type": "object",
      "additionalProperties": true,
      "properties": {
        "guid": {
          "description": "Unique identifier of the uptime check",
          "type": "string"
        },
        "subscription_id": {
          "description": "Identifier of the subscription that this check was run for",
          "type": "string"
        },
        "status": {
          "$ref": "#/definitions/CheckStatus"
        },
        "status_reason": {
          "oneOf": [
            {
              "$ref": "#/definitions/CheckStatusReason"
            },
            {
              "type": "null"
            }
          ]
        },
        "trace_id": {
          "description": "Trace ID associated with the check-in made",
          "type": "string"
        },
        "span_id": {
          "description": "Span ID associated with the check-in made. This is a phantom span generated by the uptime-checker, no real span is ingested.",
          "type": "string"
        },
        "scheduled_check_time_ms": {
          "description": "Timestamp in milliseconds of when the check was schedule to run",
          "type": "number"
        },
        "scheduled_check_time_us": {
          "description": "Timestamp in microseconds of when the check was schedule to run",
          "type": "number"
        },
        "actual_check_time_ms": {
          "description": "Timestamp in milliseconds of when the check was actually ran",
          "type": "number"
        },
        "actual_check_time_us": {
          "description": "Timestamp in microseconds of when the check was actually ran",
          "type": "number"
        },
        "duration_ms": {
          "description": "Duration of the check in ms. Will be null when the status is missed_window",
          "type": ["number", "null"]
        },
        "duration_us": {
          "description": "Duration of the check in us. Will be null when the status is missed_window",
          "type": ["number", "null"]
        },
        "request_info": {
          "oneOf": [
            {
              "$ref": "#/definitions/RequestInfo"
            },
            {
              "type": "null"
            }
          ]
        },
        "request_info_list": {
          "description": "List of all request attempts, in order of execution",
          "type": ["array"],
          "items": {
            "$ref": "#/definitions/RequestInfo"
          }
        },
        "region": {
          "description": "The region that this check was performed in",
          "type": "string"
        },
        "assertion_failure_data": {
          "oneOf": [
            {
              "$ref": "#/definitions/Assertion"
            },
            {
              "type": "null"
            }
          ]
        }
      },
      "required": [
        "guid",
        "subscription_id",
        "status",
        "status_reason",
        "trace_id",
        "span_id",
        "scheduled_check_time_ms",
        "actual_check_time_ms",
        "duration_ms",
        "request_info"
      ]
    }
  }
}
