{
  "guid": "54afc7ed9c53491481919c931f75bae1",
  "subscription_id": "5421b5df80744113a6b57014f01a3a42",
  "status": "missed_window",
  "status_reason": {
    "type": "miss_backfill",
    "description": "Miss was never reported for this scheduled check_time"
  },
  "trace_id": "947efba02dac463b9c1d886a44bafc94",
  "span_id": "58e84098e63f42e1",
  "scheduled_check_time_ms": 1717614062978,
  "actual_check_time_ms": 1717614068008,
  "duration_ms": null,
  "request_info": null
}
